{
  "artifact": "tooling-index.json",
  "artifact_schema_version": "0.1.0",
  "scope": {
    "surface": "hand-authored published docs pages included in the checked-in docs navigation with optional tooling-oriented enrichment",
    "excludes": [
      "generated markdown pages",
      "built site output",
      "repo-local non-doc markdown",
      "full-text content extraction"
    ]
  },
  "pages": [
    {
      "title": "Client ID",
      "path": "api/client-id.md",
      "nav_section": "API Reference",
      "audience": null,
      "evidence": "Source-backed from pinned snapshots",
      "summary": "`client_id` is the identifier that ties HTTP prompt submission to the WebSocket client that should receive execution updates. It is not the same thing as a prompt ID. A prompt ID identifies one queued workflow, while `client_id` identifies the frontend session that should receive targeted lifecycle events for that run.",
      "task_intents": [
        "lookup-history",
        "monitor-execution",
        "submit-prompt"
      ],
      "related_artifacts": [
        "server_endpoints.json",
        "tooling-index.json"
      ],
      "related_routes": [
        "GET /ws",
        "POST /prompt"
      ],
      "related_events": [
        "executed",
        "executing",
        "execution_cached",
        "execution_error",
        "execution_interrupted",
        "execution_start",
        "execution_success",
        "status"
      ],
      "runtime_required": true,
      "stability_tier": "pinned-baseline",
      "recommended_next_reads": [
        "api/history-queue.md",
        "api/prompt-submission.md",
        "api/websocket.md"
      ]
    },
    {
      "title": "API Endpoints",
      "path": "api/endpoints.md",
      "nav_section": "API Reference",
      "audience": null,
      "evidence": "Source-backed from pinned snapshots",
      "summary": "ComfyUI declares its HTTP and WebSocket surface directly in `server.py` using `aiohttp` route decorators. The current file defines 25 primary routes on `self.routes`, covering queue control, prompt submission, file upload and viewing, node metadata, system inspection, and job tracking.",
      "task_intents": [
        "discover-routes"
      ],
      "related_artifacts": [
        "docs-index.json",
        "manifest.json",
        "server_endpoints.json",
        "tooling-index.json"
      ],
      "related_routes": [
        "GET /history/{prompt_id}",
        "GET /object_info",
        "GET /queue",
        "GET /ws",
        "POST /prompt"
      ],
      "related_events": [],
      "runtime_required": false,
      "stability_tier": "pinned-baseline",
      "recommended_next_reads": [
        "api/prompt-submission.md",
        "api/websocket.md",
        "reference/machine-readable-artifacts.md"
      ]
    },
    {
      "title": "History and Queue",
      "path": "api/history-queue.md",
      "nav_section": "API Reference",
      "audience": null,
      "evidence": "Source-backed from pinned snapshots",
      "summary": "ComfyUI splits live scheduling state from completed execution records:",
      "task_intents": [
        "lookup-history",
        "monitor-execution"
      ],
      "related_artifacts": [
        "server_endpoints.json",
        "tooling-index.json"
      ],
      "related_routes": [
        "GET /api/jobs",
        "GET /api/jobs/{job_id}",
        "GET /history",
        "GET /history/{prompt_id}",
        "GET /prompt",
        "GET /queue",
        "POST /history",
        "POST /queue"
      ],
      "related_events": [
        "status"
      ],
      "runtime_required": true,
      "stability_tier": "pinned-baseline",
      "recommended_next_reads": [
        "api/client-id.md",
        "api/prompt-submission.md",
        "api/websocket.md"
      ]
    },
    {
      "title": "API Section Guide",
      "path": "api/index.md",
      "nav_section": "API Reference / API Section Guide",
      "audience": null,
      "evidence": "Operational guidance",
      "summary": "This hub routes readers through the API section. Use it to choose the first API page to read, not as a replacement for the route reference.",
      "task_intents": [],
      "related_artifacts": [],
      "related_routes": [],
      "related_events": [],
      "runtime_required": null,
      "stability_tier": null,
      "recommended_next_reads": []
    },
    {
      "title": "Prompt Submission",
      "path": "api/prompt-submission.md",
      "nav_section": "API Reference",
      "audience": null,
      "evidence": "Source-backed from pinned snapshots",
      "summary": "`POST /prompt` is the main execution entrypoint. The handler accepts a workflow payload, validates it, assigns queue priority, extracts sensitive metadata, and enqueues the prompt for asynchronous execution.",
      "task_intents": [
        "submit-prompt"
      ],
      "related_artifacts": [
        "server_endpoints.json",
        "tooling-index.json"
      ],
      "related_routes": [
        "POST /prompt"
      ],
      "related_events": [
        "executed",
        "executing",
        "execution_cached",
        "execution_error",
        "execution_interrupted",
        "execution_start",
        "execution_success"
      ],
      "runtime_required": true,
      "stability_tier": "pinned-baseline",
      "recommended_next_reads": [
        "api/history-queue.md",
        "api/websocket.md",
        "reference/machine-readable-artifacts.md"
      ]
    },
    {
      "title": "WebSocket",
      "path": "api/websocket.md",
      "nav_section": "API Reference",
      "audience": null,
      "evidence": "Source-backed from pinned snapshots",
      "summary": "ComfyUI uses `GET /ws` as the real-time channel for queue state, execution lifecycle messages, UI output updates, and preview images. The route is implemented with `aiohttp.WebSocketResponse` and is the main mechanism that keeps the frontend in sync while a prompt runs.",
      "task_intents": [
        "monitor-execution"
      ],
      "related_artifacts": [
        "server_endpoints.json",
        "tooling-index.json"
      ],
      "related_routes": [
        "GET /ws"
      ],
      "related_events": [
        "executed",
        "executing",
        "execution_cached",
        "execution_error",
        "execution_interrupted",
        "execution_start",
        "execution_success",
        "feature_flags",
        "status"
      ],
      "runtime_required": true,
      "stability_tier": "pinned-baseline",
      "recommended_next_reads": [
        "api/history-queue.md",
        "api/prompt-submission.md",
        "how-to/monitor-execution.md"
      ]
    },
    {
      "title": "Execution Pipeline",
      "path": "architecture/execution-pipeline.md",
      "nav_section": "Architecture",
      "audience": null,
      "evidence": "Source-backed from pinned snapshots",
      "summary": "This page documents the server-side execution pipeline that turns a submitted prompt into queued work, live events, and stored history. It is an architecture-level map of responsibilities and boundaries, not a step-by-step API tutorial or a full engine internals reference.",
      "task_intents": [],
      "related_artifacts": [],
      "related_routes": [],
      "related_events": [],
      "runtime_required": null,
      "stability_tier": null,
      "recommended_next_reads": []
    },
    {
      "title": "Architecture Overview",
      "path": "architecture/overview.md",
      "nav_section": "Architecture",
      "audience": null,
      "evidence": "Official docs-backed from docs.comfy.org; Source-backed from pinned snapshots",
      "summary": "This page is a bounded conceptual overview of ComfyUI architecture for readers who need the system shape before diving into detailed reference pages.",
      "task_intents": [],
      "related_artifacts": [],
      "related_routes": [],
      "related_events": [],
      "runtime_required": null,
      "stability_tier": null,
      "recommended_next_reads": []
    },
    {
      "title": "Server-Side Composition",
      "path": "architecture/server-side-composition.md",
      "nav_section": "Architecture",
      "audience": null,
      "evidence": "Source-backed from pinned snapshots",
      "summary": "This page maps how ComfyUI composes its running server surface: route tables, manager-owned subsystems, extension web assets, prompt hooks, and execution integration points. It is not a route-by-route API reference and not a frontend hook catalog.",
      "task_intents": [],
      "related_artifacts": [],
      "related_routes": [],
      "related_events": [],
      "runtime_required": null,
      "stability_tier": null,
      "recommended_next_reads": []
    },
    {
      "title": "Best Practices",
      "path": "custom-nodes/best-practices.md",
      "nav_section": "Custom Nodes",
      "audience": null,
      "evidence": "Official docs-backed from docs.comfy.org; Community pattern study based on pinned external version",
      "summary": "Good custom nodes are predictable in graphs, easy to validate, friendly to caching, and clear about what they do. The biggest failures in ComfyUI node packs usually come from unclear contracts, unnecessary monkey patching, and hidden runtime assumptions.",
      "task_intents": [],
      "related_artifacts": [],
      "related_routes": [],
      "related_events": [],
      "runtime_required": null,
      "stability_tier": null,
      "recommended_next_reads": []
    },
    {
      "title": "Datatypes",
      "path": "custom-nodes/datatypes.md",
      "nav_section": "Custom Nodes",
      "audience": null,
      "evidence": "Official docs-backed from docs.comfy.org",
      "summary": "ComfyUI datatypes serve two roles at once:",
      "task_intents": [],
      "related_artifacts": [],
      "related_routes": [],
      "related_events": [],
      "runtime_required": null,
      "stability_tier": null,
      "recommended_next_reads": []
    },
    {